{
  "horasMensuales": {
    "valor": 180,
    "norma": "30 días por jornada de 6 horas (Estatuto del Periodista y CCT 131/75)"
  },
  "horasPorJornada": {
    "valor": 6,
    "norma": "Jornada del Estatuto del Periodista y del CCT 131/75"
  },
  "vidaUtilDeEquiposEnMeses": {
    "valor": 24,
    "norma": "Criterio de la investigación: obsolescencia del equipo de trabajo"
  },
  "consumoDelAutoCada100Km": {
    "valor": 8,
    "norma": "Auto naftero convencional en uso mixto, con el peso del equipo; el usuario lo puede cambiar",
    "aclaracion": "Para un auto de uso diario con motor naftero convencional, 8 L / 100 km es un promedio razonable únicamente para un uso mixto (ciudad + ruta). Se contempla el peso del equipamiento a transportar."
  },
  "consumoDeLaMotoCada100Km": {
    "valor": 4,
    "norma": "Moto en uso mixto; el usuario lo puede cambiar",
    "aclaracion": "Para una moto de uso diario, 4 L / 100 km es un promedio razonable únicamente para un uso mixto (ciudad + ruta)."
  },
  "vacaciones": {
    "divisorDelDia": 25,
    "diasPorAntiguedad": [
      { "desdeAnios": 0, "dias": 14 },
      { "desdeAnios": 5, "dias": 21 },
      { "desdeAnios": 10, "dias": 28 },
      { "desdeAnios": 20, "dias": 35 }
    ],
    "norma": "Ley de Contrato de Trabajo 20.744, arts. 150 y 155"
  },
  "sueldoAnualComplementario": {
    "sueldosPorAnio": 1,
    "norma": "Ley de Contrato de Trabajo 20.744, arts. 121 y 122; Ley 23.041"
  },
  "encuesta": {
    "url": "https://docs.google.com/forms/d/e/1FAIpQLSd55yQCjU9Yq4b4edqJqXPEZH5p8r1UEQdV0XRDoUPc3yFTXQ/viewform?usp=dialog"
  },
  "dolarOficial": {
    "valor": 1512.5,
    "fecha": "2026-10-13",
    "fuente": "BCRA, cotización de referencia (API de estadísticas cambiarias)"
  },
  "dolarBlue": {
    "valor": 1565,
    "fecha": "2026-10-21",
    "fuente": "dolarapi.com, dólar blue (venta)"
  }
}
